{
  "$schema":"https://json-schema.org/draft/2020-12/schema","type":"object","additionalProperties":false,
  "required":["schema_version","status","purpose","sources","analyses","controls"],
  "properties":{
    "schema_version":{"const":"orthogonal-biomedical-source-catalog-v1"},"status":{"const":"prospective_metadata_only_new_freeze_required"},"purpose":{"type":"string","minLength":1},
    "sources":{"type":"array","minItems":17,"uniqueItems":true,"items":{"type":"object","additionalProperties":false,"required":["source_id","name","release","domains","languages","evidence_roles","mapping_uses","authority_url","licence_url","archive_route","lineage_group","analysis_ids","notes"],"properties":{"source_id":{"pattern":"^[a-z0-9-]+$"},"name":{"type":"string","minLength":1},"release":{"type":"string","minLength":1},"domains":{"type":"array","minItems":1,"uniqueItems":true,"items":{"type":"string"}},"languages":{"type":"array","minItems":1,"uniqueItems":true,"items":{"type":"string"}},"evidence_roles":{"type":"array","minItems":1,"uniqueItems":true,"items":{"type":"string"}},"mapping_uses":{"type":"array","minItems":1,"uniqueItems":true,"items":{"type":"string"}},"authority_url":{"type":"string","format":"uri","pattern":"^https://"},"licence_url":{"type":"string","format":"uri","pattern":"^https://"},"archive_route":{"enum":["metadata_only","public_after_checksum","public_after_file_level_scan","public_after_attribution_and_checksum","public_after_exact_release_pin","public_after_exact_release_and_definition_audit","public_after_per_component_release_and_licence_pin","rights_filtered_public_projection_only"]},"lineage_group":{"type":"string","minLength":1},"analysis_ids":{"type":"array","minItems":1,"uniqueItems":true,"items":{"pattern":"^O[1-9]$"}},"notes":{"type":"string","minLength":1}}}},
    "analyses":{"type":"array","minItems":9,"maxItems":9,"items":{"type":"object","additionalProperties":false,"required":["analysis_id","question","design"],"properties":{"analysis_id":{"pattern":"^O[1-9]$"},"question":{"type":"string","minLength":1},"design":{"type":"string","minLength":1}}}},
    "controls":{"type":"object","additionalProperties":false,"required":["payload_retrieval_authorized","remote_upload_authorized","empirical_execution_authorized","direct_lexical_vote_allowed","automatic_promotion_allowed","new_freeze_required"],"properties":{"payload_retrieval_authorized":{"const":false},"remote_upload_authorized":{"const":false},"empirical_execution_authorized":{"const":false},"direct_lexical_vote_allowed":{"const":false},"automatic_promotion_allowed":{"const":false},"new_freeze_required":{"const":true}}}
  }
}
