{
  "schema_version": "orthogonal-biomedical-source-catalog-v1",
  "status": "prospective_metadata_only_new_freeze_required",
  "purpose": "Govern orthogonal biomedical evidence that may improve HPO translation disambiguation, semantic checking, negative controls, and downstream validation without treating adjacent-domain terms as phenotype translations.",
  "sources": [
    {"source_id":"who-atc-ddd","name":"WHO ATC/DDD","release":"2026","domains":["drug_classification","therapeutic_context"],"languages":["en","es"],"evidence_roles":["medication_conditioned_disambiguation","negative_control"],"mapping_uses":["drug_to_ingredient_to_indication_context"],"authority_url":"https://atcddd.fhi.no/atc_ddd_index/","licence_url":"https://atcddd.fhi.no/filearchive/publications/2026_guidelines_for_atc_classification_and_ddd_assignment.pdf","archive_route":"metadata_only","lineage_group":"who-atc-ddd","analysis_ids":["O1","O4","O6"],"notes":"ATC mixes anatomical, therapeutic, pharmacological and chemical properties; DDD is not clinical dosing advice."},
    {"source_id":"who-atcvet","name":"WHO ATCvet","release":"2026","domains":["veterinary_drug_classification"],"languages":["en"],"evidence_roles":["cross_species_negative_control"],"mapping_uses":["species_leakage_detection"],"authority_url":"https://atcddd.fhi.no/atcvet/atcvet_index_and_guidelines/atcvet_index/","licence_url":"https://atcddd.fhi.no/filearchive/publications/2026_guidelines_for_atc_classification_and_ddd_assignment.pdf","archive_route":"metadata_only","lineage_group":"who-atc-family","analysis_ids":["O6","O9"],"notes":"Never generalize veterinary therapeutic context to human phenotype equivalence."},
    {"source_id":"rxnorm-atcprod","name":"RxNorm and RxClass ATCPROD","release":"current_release_unpinned","domains":["clinical_drugs","drug_mapping"],"languages":["en"],"evidence_roles":["identity_bridge","medication_context"],"mapping_uses":["atc_product_to_rxcui"],"authority_url":"https://www.nlm.nih.gov/research/umls/rxnorm/overview.html","licence_url":"https://www.nlm.nih.gov/research/umls/rxnorm/faq.html","archive_route":"metadata_only","lineage_group":"nlm-rxnorm","analysis_ids":["O1","O4"],"notes":"Full releases may include restricted source vocabularies; ATCPROD is incomplete and US-centric."},
    {"source_id":"chebi","name":"ChEBI","release":"252","domains":["chemicals","biochemical_roles"],"languages":["undetermined_in_release"],"evidence_roles":["chemical_identity","compositional_constraint"],"mapping_uses":["chemical_or_metabolite_disambiguation"],"authority_url":"https://www.ebi.ac.uk/ols4/ontologies/chebi","licence_url":"https://creativecommons.org/licenses/by/4.0/","archive_route":"public_after_file_level_scan","lineage_group":"ebi-chebi","analysis_ids":["O1","O2","O5"],"notes":"Audit released language tags and inherited synonym provenance before any lexical use."},
    {"source_id":"go","name":"Gene Ontology","release":"2026-03-25","domains":["biological_process","molecular_function","cellular_component"],"languages":["en"],"evidence_roles":["mechanistic_constraint","hard_negative"],"mapping_uses":["logical_definition_consistency"],"authority_url":"https://www.ebi.ac.uk/ols4/ontologies/go","licence_url":"https://creativecommons.org/licenses/by/4.0/","archive_route":"public_after_checksum","lineage_group":"gene-ontology","analysis_ids":["O1","O2","O8"],"notes":"A process or function label is not a phenotype label."},
    {"source_id":"uberon-cl","name":"Uberon and Cell Ontology","release":"uberon-2026-04-01_cl-2026-06-08","domains":["anatomy","cell"],"languages":["en"],"evidence_roles":["anatomical_constraint","cellular_constraint"],"mapping_uses":["eq_composition","logical_definition_consistency"],"authority_url":"https://www.ebi.ac.uk/ols4/ontologies/uberon","licence_url":"https://creativecommons.org/licenses/by/3.0/","archive_route":"public_after_attribution_and_checksum","lineage_group":"obophenotype-anatomy-cell","analysis_ids":["O1","O2","O8"],"notes":"Generated bridges and their source mappings are one lineage, not independent votes."},
    {"source_id":"oba-pato-ro","name":"OBA, PATO and Relations Ontology","release":"current_release_unpinned","domains":["biological_attributes","qualities","relations"],"languages":["en"],"evidence_roles":["attribute_quality_constraint","predicate_validation"],"mapping_uses":["eq_composition","route_semantics"],"authority_url":"https://obofoundry.org/ontology/oba.html","licence_url":"https://creativecommons.org/publicdomain/zero/1.0/","archive_route":"metadata_only","lineage_group":"obo-composition-stack","analysis_ids":["O1","O2","O4","O8"],"notes":"An attribute or quality is not an abnormal phenotype without the required context."},
    {"source_id":"nbo-symp","name":"Neuro Behavior Ontology and Symptom Ontology","release":"current_release_unpinned","domains":["behaviour","symptoms"],"languages":["en"],"evidence_roles":["behavioural_constraint","patient_term_discovery"],"mapping_uses":["symptom_sign_boundary","behaviour_context"],"authority_url":"https://obofoundry.org/ontology/nbo.html","licence_url":"https://creativecommons.org/licenses/by/3.0/","archive_route":"metadata_only","lineage_group":"obo-behaviour-symptom","analysis_ids":["O1","O3","O6"],"notes":"Subjective symptoms and objective signs remain distinct; sparse definitions limit lexical authority."},
    {"source_id":"envo-ecto-exo","name":"ENVO, ECTO and ExO","release":"envo-2025-10-20_others-unpinned","domains":["environment","exposure","causal_context"],"languages":["en"],"evidence_roles":["exposure_context","causal_negative_control"],"mapping_uses":["cause_manifestation_boundary"],"authority_url":"https://obofoundry.org/ontology/envo.html","licence_url":"https://creativecommons.org/publicdomain/zero/1.0/","archive_route":"public_after_per_component_release_and_licence_pin","lineage_group":"obo-environment-exposure","analysis_ids":["O3","O6"],"notes":"Exposure or cause terms must never substitute for manifestations."},
    {"source_id":"pro-uo-ncbitaxon","name":"Protein Ontology, Units Ontology and NCBITaxon","release":"current_release_unpinned","domains":["proteins","units","taxonomy"],"languages":["en"],"evidence_roles":["mechanistic_constraint","unit_consistency","taxon_leakage_control"],"mapping_uses":["entity_type_validation","quantitative_validation","species_validation"],"authority_url":"https://obofoundry.org/ontology/pr.html","licence_url":"https://creativecommons.org/licenses/by/4.0/","archive_route":"metadata_only","lineage_group":"obo-orthogonal-controls","analysis_ids":["O3","O8","O9"],"notes":"These sources validate entity type and context, not translated phenotype wording."},
    {"source_id":"who-icf","name":"WHO ICF","release":"2026-01","domains":["functioning","disability","activity_participation"],"languages":["hy","zh","cs","en","et","fi","fr","it","mn","pt","ru","sk","es","tr","uk"],"evidence_roles":["functional_context","severity_impact_context"],"mapping_uses":["functioning_phenotype_boundary"],"authority_url":"https://icd.who.int/docs/icd-api/SupportedClassifications/","licence_url":"https://www.who.int/about/policies/publishing/copyright","archive_route":"metadata_only","lineage_group":"who-classification-suite","analysis_ids":["O1","O3","O7"],"notes":"CC BY-ND 3.0 IGO and mapping conditions require exact review; mapped context is not phenotype equivalence."},
    {"source_id":"pro-ctcae","name":"NCI PRO-CTCAE","release":"authority-table-2026-08-11","domains":["patient_reported_symptoms","severity","interference"],"languages":["multilingual_country_variant_catalog"],"evidence_roles":["patient_register_comparator","regional_variant_context"],"mapping_uses":["patient_clinician_register_analysis"],"authority_url":"https://healthcaredelivery.cancer.gov/pro-ctcae/countries-pro.html","licence_url":"https://healthcaredelivery.cancer.gov/pro-ctcae/language.html","archive_route":"metadata_only","lineage_group":"nci-pro-ctcae","analysis_ids":["O1","O5","O7"],"notes":"Written permission is required for translation or adaptation; Twi does not resolve the repository tw identity conflict."},
    {"source_id":"medlineplus","name":"MedlinePlus Health Topics XML","release":"daily_snapshot_unpinned","domains":["consumer_health","disease_context"],"languages":["en","es"],"evidence_roles":["lay_register_comparator","mesh_bridge"],"mapping_uses":["english_spanish_topic_pairing","lay_clinical_register_analysis"],"authority_url":"https://medlineplus.gov/xml.html","licence_url":"https://medlineplus.gov/about/using/usingcontent/","archive_route":"rights_filtered_public_projection_only","lineage_group":"nlm-medlineplus","analysis_ids":["O1","O5","O7"],"notes":"Raw XML may link to third-party content; archive only an element-level rights-filtered projection publicly."},
    {"source_id":"radlex","name":"RadLex","release":"current_release_unpinned","domains":["radiology","imaging_findings"],"languages":["en","de"],"evidence_roles":["imaging_context","specialty_register"],"mapping_uses":["radiographic_phenotype_disambiguation"],"authority_url":"https://www.rsna.org/practice-tools/data-tools-and-standards/radlex-radiology-lexicon","licence_url":"https://www.rsna.org/uploadedfiles/rsna/content/informatics/radlex_public_license_version_1-0-1.pdf","archive_route":"metadata_only","lineage_group":"rsna-radlex","analysis_ids":["O1","O3","O7"],"notes":"Registration and redistribution conditions require review; Portuguese is not admitted as current."},